main_ID,Ano,Beneficiario,RFC,RNPA,Estado,Municipio,Localidad,Monto
,2012,"PESQUERA IRASEMA, S.A. DE C.V.",PIR920901HH7,2508005572,SINALOA,MAZATLAN,MAZATLAN,246360
,2012,"PESQUERA ISLA DE GUADALUPE, S.A. DE C.V.",PIG070612211,2508011992,SINALOA,MAZATLAN,MAZATLAN,235194
,2012,"PESQUERA ISLA DE LA GUARDIA, S.A. DE C.V.",PIG900503JA2,203007471,BAJA CALIFORNIA,ENSENADA,ENSENADA,254120
,2012,"PESQUERA ISSOL, S.A. DE C.V.",PIS001123DP1,2508010614,SINALOA,MAZATLAN,MAZATLAN,493960
,2012,"PESQUERA JAHAIRA, S.A. DE C.V.",PJA990728D67,2508009897,SINALOA,MAZATLAN,MAZATLAN,809654
,2012,"PESQUERA JALILI, S.A. DE C.V.",PJA9107226I4,2508005879,SINALOA,MAZATLAN,MAZATLAN,6448146
,2012,"PESQUERA JESPA, S.A. DE C.V.",PJE920522264,2604007514,SONORA,GUAYMAS,HEROICA GUAYMAS,926240
,2012,"PESQUERA JESUS ALBERTO, S.A. DE C.V.",PJA020311B26,2508010838,SINALOA,MAZATLAN,MAZATLAN,973960
,2012,"PESQUERA JULIANA, S.A. DE C.V.",PJU100429KL3,2508015001,SINALOA,MAZATLAN,MAZATLAN,964120
,2012,"PESQUERA JUSAJELI, S.A. DE C.V.",PJU940224AG4,2508006778,SINALOA,MAZATLAN,MAZATLAN,7749268
,2012,"PESQUERA KUKULKAN, S.A. DE C.V.",PKU970423DB6,2604010476,SONORA,GUAYMAS,SONORA,343194
,2012,"PESQUERA LA MESA CENTRAL, S.A. DE C.V.",PMC0204304T5,2808007005,TAMAULIPAS,TAMPICO,TAMPICO,310000
,2012,"PESQUERA LA MIRADA, S.A. DE C.V.",PMI000425F81,2508009921,SINALOA,MAZATLAN,MAZATLAN,3084264
,2012,PESQUERA LA PAPALOTA SA DE CV,PPA1111024Q4,2508015969,SINALOA,MAZATLAN,MAZATLAN,236074
,2012,"PESQUERA LA TUNA, S.A. DE C.V.",PTU9405204I5,2508007693,SINALOA,MAZATLAN,MAZATLAN,297970
,2012,"PESQUERA LENA, S.A. DE C.V.",PLE900913RB8,2508006828,SINALOA,MAZATLAN,MAZATLAN,846980
,2012,"PESQUERA LESLIE, S.A. DE C.V.",PLE961012929,2508008493,SINALOA,MAZATLAN,MAZATLAN,493960
,2012,PESQUERA LUNA HERMANOS SA DE CV,PLH010404J17,2607004088,SONORA,PUERTO PEÑASCO,PUERTO PEÑASCO,80000
,2012,"PESQUERA MACAREL, S.A. DE C.V.",PMA790831NP5,203011804,BAJA CALIFORNIA,ENSENADA,EL SAUZAL DE RODRIGUEZ,218520
,2012,"PESQUERA MAGGI MAGGI, S.A. DE C.V.",PMM020416Q38,2508010507,SINALOA,MAZATLAN,MAZATLAN,277970
,2012,"PESQUERA MARBEA, S.A. DE C.V.",PMA9812023Y0,2508009566,SINALOA,MAZATLAN,MAZATLAN,3785320
,2012,"PESQUERA MARIA BELEN, S.A. DE C.V.",PMB0911237Q4,203014816,BAJA CALIFORNIA,ENSENADA,ENSENADA,525348
,2012,"PESQUERA MARIA ROSA, S.A. DE C.V.",PMR9807243E8,2508011265,SINALOA,MAZATLAN,MAZATLAN,430388
,2012,"PESQUERA MARINA DEL GOLFO, S.A. DE C.V.",PMG910702QB4,401002977,CAMPECHE,CAMPECHE,SAN FRANCISCO DE CAMPECHE,299980
,2012,"PESQUERA MATATAN, S.A. DE C.V.",PMA9307062I5,2508005697,SINALOA,MAZATLAN,MAZATLAN,218120
,2012,"PESQUERA MAUCER, S.A. DE C.V.",PMA9601238W4,2604009809,SONORA,GUAYMAS,SONORA,993936
,2012,"PESQUERA MAZATLECOS, S.A. DE C.V.",PMA971114UN7,2508009079,SINALOA,MAZATLAN,MAZATLAN,493960
,2012,"PESQUERA MAZCU I, S.A. DE C.V",PMI960222ET9,2508008303,SINALOA,MAZATLAN,MAZATLAN,623700
,2012,"PESQUERA MERKABA, S.A. DE C.V.",PME9308169SA,2508006810,SINALOA,MAZATLAN,MAZATLAN,266980
,2012,"PESQUERA MIRIAM, S.A. DE C.V.",PMI940418JKA,2508007123,SINALOA,MAZATLAN,MAZATLAN,391300
,2012,"PESQUERA MIRYAM, S.A. DE C.V.",PMI990212TQ3,2508009624,SINALOA,CULIACAN,CULIACAN ROSALES,3753750
,2012,"PESQUERA MORMAR, S.A. DE C.V.",PMO920616MJ0,2508005408,SINALOA,MAZATLAN,MAZATLAN,888406
,2012,"PESQUERA MUNDO, S.A. DE C.V.",PPM021004UP2,203126693,BAJA CALIFORNIA,ENSENADA,ENSENADA,215194
,2012,"PESQUERA NACOZARI, S.A. DE C.V.",PNA940705271,2508007362,SINALOA,MAZATLAN,MAZATLAN,162974
,2012,"PESQUERA NADIA, S.A. DE C.V.",PNA930512UBA,2508006398,SINALOA,MAZATLAN,MAZATLAN,235194
,2012,"PESQUERA NAIR, S.A. DE C.V.",PNA801211229,203001904,SINALOA,MAZATLAN,MAZATLAN,5357660
,2012,"PESQUERA NAOMI, S.A. DE C.V.",PNA0201216P2,2508010762,SINALOA,MAZATLAN,MAZATLAN,1249652
,2012,"PESQUERA NAVIDAD DEL PACIFICO, S.A. DE C.V.",PNP070430AT5,2508011851,SINALOA,MAZATLAN,MAZATLAN,235194
,2012,"PESQUERA NUEVA, S.A. DE C.V.",PNU010608AL3,2604011300,SONORA,GUAYMAS,SAN JOSE DE GUAYMAS,1249534
,2012,"PESQUERA OJEDA Y PAYAN, S.A. DE C.V.",POP9806024B0,2607003734,SONORA,PUERTO PEÑASCO,PUERTO PEÑASCO,292600
,2012,"PESQUERA PATRON E HIJOS, S.A. DE C.V.",PPH811016KA7,203004411,BAJA CALIFORNIA,ENSENADA,ENSENADA,320000
,2012,"PESQUERA PELAGICA, S.A. DE C.V.",PPE040908FD0,2508011232,SINALOA,MAZATLAN,MAZATLAN,263614
,2012,"PESQUERA PELICANOS, S.A. DE C.V.",PPE940207TL3,2604008686,SONORA,GUAYMAS,SAN JOSE DE GUAYMAS,142974
,2012,"PESQUERA PERLA DE SALINA CRUZ, S.A. DE C.V.",PPS980211IG7,2005002809,OAXACA,SALINA CRUZ,SALINA CRUZ,1678644
,2012,"PESQUERA PIAXTLA, S.A. DE C.V.",PPI051211M55,2607004385,SONORA,PUERTO PEÑASCO,PUERTO PEÑASCO,369494
,2012,"PESQUERA PROESA, S.A. DE C.V.",PPR951212M65,203012414,SONORA,GUAYMAS,HEROICA GUAYMAS,292600
,2012,"PESQUERA PROGRESO, S.A. DE C.V.",PPR830112AP6,203003769,BAJA CALIFORNIA,ENSENADA,ENSENADA,372398
,2012,"PESQUERA PUNTA CERRITOS, S.A. DE C.V.",PPC960617G74,2508010341,SINALOA,MAZATLAN,MAZATLAN,222824
,2012,"PESQUERA PUNTA DEL GAVILAN, S.A. DE C.V.",PPG950207RR0,2607004302,SONORA,PUERTO PEÑASCO,PUERTO PEÑASCO,259980
,2012,"PESQUERA PUNTA PEÑASCO, S.A. DE C.V.",PPP9507187U6,2607003387,SONORA,PUERTO PEÑASCO,PUERTO PEÑASCO,1636448
,2012,"PESQUERA PUNTA PIAXTLA, S.A. DE C.V.",PPP910911NT8,2508005614,SINALOA,MAZATLAN,MAZATLAN,235194
,2012,"PESQUERA QUICHO, S.C. DE R.L. DE C.V.",PQU060426HG6,2507004600,SINALOA,AHOME,LOS MOCHIS,226520
,2012,"PESQUERA RAY, S.A. DE C.V.",PRA091013FY7,2508014962,SINALOA,MAZATLAN,MAZATLAN,248500
,2012,"PESQUERA RIO SINALOA, S.A. DE C.V.",PRS980602977,2607003726,SONORA,PUERTO PEÑASCO,PUERTO PEÑASCO,259980
,2012,"PESQUERA RIOSLA, S.A. DE C.V.",PRI950308KKA,2508007388,SINALOA,MAZATLAN,MAZATLAN,418018
,2012,"PESQUERA SAGUI, S.A. DE C.V.",PSA9405166N4,2604008447,SONORA,GUAYMAS,SAN JOSE DE GUAYMAS,1334522
,2012,"PESQUERA SAN SEBASTIAN, S.A. DE C.V.",PSS020612JY1,2505002846,SINALOA,GUASAVE,GUASAVE,1169758
,2012,"PESQUERA SANDRA KORINA, S.A. DE C.V.",PSK011206EN1,2508010457,SINALOA,MAZATLAN,MAZATLAN,1597354
,2012,"PESQUERA SANTA CATALINA, S.A. DE C.V.",PSC930427RN0,2508006232,SINALOA,MAZATLAN,MAZATLAN,333200
,2012,"PESQUERA SANTA MONICA, S.A. DE C.V.",PSM870112I90,2604004727,SONORA,GUAYMAS,HEROICA GUAYMAS,681800
,2012,"PESQUERA SARDIMAR, S.A. DE C.V.",PSA020930N92,203126644,BAJA CALIFORNIA,ENSENADA,ENSENADA,368000
,2012,"PESQUERA SARDINERA LA UNION, S. DE R.L. DE C.V.",PSU020410UU6,203126707,BAJA CALIFORNIA,ENSENADA,ENSENADA,405300
,2012,"PESQUERA SEJOMAR, S.A. DE C.V.",PSE020527DE5,2508010515,SINALOA,MAZATLAN,MAZATLAN,296500
,2012,"PESQUERA SELECTA DE GUAYMAS, S.A. DE C.V.",PSG911003G7A,2604007720,SONORA,GUAYMAS,HEROICA GUAYMAS,1838718
,2012,"PESQUERA SERGIO MAR, S.A. DE C.V.",PSM7808315I7,2508006224,SINALOA,MAZATLAN,MAZATLAN,255194
,2012,"PESQUERA SIGLO, S.A. DE C.V.",PSI9508249S1,2604009452,SONORA,GUAYMAS,HEROICA GUAYMAS,7391740
,2012,"PESQUERA SINAI, S.A. DE C.V.",PSI92062575A,2604006342,SONORA,GUAYMAS,SAN JOSE DE GUAYMAS,993398
,2012,"PESQUERA SON MAR DEL PACIFICO, S.A. DE C.V.",PSM950713V68,2604009171,SONORA,GUAYMAS,HEROICA GUAYMAS,4748100
,2012,"PESQUERA STHEPANIE, S.A. DE C.V.",PST980519RQ5,2508009095,SINALOA,MAZATLAN,MAZATLAN,235194
,2012,"PESQUERA THOR, S.A. DE C.V.",PTH020801C51,203126586,BAJA CALIFORNIA,ENSENADA,EL SAUZAL DE RODRIGUEZ,362674
,2012,"PESQUERA TRES MARÍAS, S.A. DE C.V.",PTM9305144FA,2604008116,SONORA,GUAYMAS,SAN JOSE DE GUAYMAS,215194
,2012,"PESQUERA UNION LIBRE, S.A. DE C.V.",PUL930225D93,2508005937,SINALOA,MAZATLAN,MAZATLAN,502174
,2012,"PESQUERA VICTORIA I, S.A. DE C.V.",PVI9407078T3,2508007867,SINALOA,MAZATLAN,MAZATLAN,162974
,2012,"PESQUERA VILLALOBOS, S. DE R.L. DE C.V.",PVI850909ML4,2604009908,SONORA,GUAYMAS,HEROICA GUAYMAS,667800
,2012,"PESQUERA VILO, S.A. DE C.V.",PVI9410268X2,2604009734,SONORA,GUAYMAS,HEROICA GUAYMAS,226520
,2012,"PESQUERA VIRGEN DE LORETO, S.A. DE C.V.",PVL930420AG6,2508006166,SINALOA,MAZATLAN,MAZATLAN,325948
,2012,"PESQUERA WENDY, S.A. DE C.V.",PWE060406GB1,2604001392,SONORA,GUAYMAS,HEROICA GUAYMAS,292600
,2012,"PESQUERA Y ACUICOLA ROIZ, S.C. DE R.L. DE C.V.",PAR060126UX9,2507004014,SINALOA,AHOME,LOS MOCHIS,160000
,2012,"PESQUERA Y PROCESADORA MAR DE CORTEZ, S.A. DE C.V.",PPM9603135A9,2607003460,SONORA,PUERTO PEÑASCO,PUERTO PEÑASCO,2534682
,2012,"PESQUERA YESENIA, S.A. DE C.V.",PYE060303MI9,2508011489,SINALOA,MAZATLAN,MAZATLAN,451300
,2012,"PESQUERA ZULEMA, S.A DE C.V.",PZU940727KW8,2508008501,SINALOA,MAZATLAN,MAZATLAN,173614
,2012,"PESQUERIA 15 DE SEPTIEMBRE, S.A. DE C.V.",PQS910807P48,2508005648,SINALOA,MAZATLAN,MAZATLAN,7133320
,2012,PIER GUTIERREZ DE LARA OSCAR,,2808000455,TAMAULIPAS,TAMPICO,TAMPICO,276500
,2012,PIER KIENTZLE OSCAR ALFONSO,,2808006015,TAMAULIPAS,TAMPICO,TAMPICO,276500
,2012,PIMIENTA MONTIEL JONATHAN,,2808006726,TAMAULIPAS,TAMPICO,TAMPICO,200000
,2012,"PLANTA PROCESADORA LA ISLITA, S.C. DE R.L. DE C.V.",PPL080305EE2,2501005223,SINALOA,CULIACAN,CULIACAN ROSALES,28000
,2012,"PLYA ESCONDIDA DE CEUTA, S.C. DE R.L. DE C.V.",PEC0905134CA,2501005405,SINALOA,ELOTA,LA CRUZ,32000
,2012,"PMG ACUICOLA SOL Y MAR, S.A. DE C.V.",PAS080403SKA,2611001518,SONORA,HERMOSILLO,HERMOSILLO,40000
,2012,POLANCO MARIN MARIA DEL CARMEN,,3105004042,YUCATAN,PROGRESO,PROGRESO,224000
,2012,PORTO JAIBO S.A. DE C.V.,PJA1105251L8,2808007690,TAMAULIPAS,TAMPICO,TAMPICO,552600
,2012,"PREDIO EL MANGLON, S.C.L DE C.V.",PMS970611D13,2505002259,SINALOA,GUASAVE,LA BRECHA,240000
,2012,PRODUCCION ACUICOLA LA MURALLA SPR DE RL,PAM970108U14,1803000809,NAYARIT,ACAPONETA,ACAPONETA,30000
,2012,PRODUCTORA ACUICOLA NUEVA HIGUERA S.P.R DE R.I,PAN080214RW6,2507004774,SINALOA,AHOME,HIGUERA DE ZARAGOZA,60000
,2012,"PRODUCTORA DE ESPECIES ACUATICAS DE BARRON, S.A. DE",PEA950906TQ7,2508007859,SINALOA,MAZATLAN,MAZATLAN,52000
,2012,"PRODUCTORA DE ESPECIES ACUATICAS, S.A. DE C.V.",PEA881214FLA,2505001723,SINALOA,GUASAVE,GUASAVE,320000
,2012,"PRODUCTORA PESQUERA DEL MAR DEL PAFICIO, S.C. DE R.L.",PPM010924QP9,2506001003,SINALOA,ANGOSTURA,BATURY,236800
,2012,"PRODUCTORA Y COMERCIALIZADORA EL TREBOL, S.A. DE C.V.",PCT960411MU3,2005000779,OAXACA,SALINA CRUZ,SALINA CRUZ,215194
,2012,"PRODUCTORES ACUICOLA DEL EVORA, S.A. DE C.V.",PAE1003119L7,2505003745,SINALOA,SALVADOR ALVARADO,GUAMUCHIL,176000
,2012,"PRODUCTORES MARINOS SINALOENSES, S.A. DE C.V.",PMS080401UI5,2501005330,SINALOA,ELOTA,COLONIA BUENOS AIRES,140000
,2012,"PRODUCTORES TRIMARINOS, S.A. DE C.V.",PTR090922V31,2501005512,SINALOA,ELOTA,ELOTA,140000
,2012,"PRODUCTOS MARINOS CAREY, S.A. DE C.V.",PMC0203196B6,3102001082,YUCATAN,DZILAM DE BRAVO,DZILAM DE BRAVO,346350
,2012,"PRODUCTOS PESQUEROS DE MATANCITAS, S.A. DE C.V.",PPM7610048B6,203001375,BAJA CALIFORNIA SUR,COMONDU,PUERTO ADOLFO LOPEZ MATEOS,673430
,2012,"PRODUCTOS PESQUEROS DE TAMPICO, S.A. DE C.V.",PPT9511308N8,2808005553,TAMAULIPAS,TAMPICO,TAMPICO,682640
,2012,"PROPE, S.A. DE C.V.",PPE990520RK0,2808005066,TAMAULIPAS,TAMPICO,TAMPICO,259980
,2012,"PROSPECCION PESQUERA DE MEXICO, S.A. DE C.V.",PPM900420A59,401002993,CAMPECHE,CAMPECHE,SAN FRANCISCO DE CAMPECHE,266520
,2012,"PUNTA CAMARON, S.P.R. DE R.L. DE C.V.",PCA041209379,2801001229,TAMAULIPAS,ALDAMA,ALDAMA,40000
,2012,"QUECHORAGUI, S.P.R. DE R.I.",QSR980805SR0,2607010820,SONORA,CAJEME,CIUDAD OBREGON,292600
,2012,QUIÑONEZ GALVAN JOSE DE JESUS,,3105002731,YUCATAN,PROGRESO,PROGRESO,200000
,2012,"QUINTA SAN FABIAN ACUACULTORES, S.P.R. DE R.L. DE C.V.",QSF090310A92,2604090999,SONORA,GUAYMAS,HEROICA GUAYMAS,204800
,2012,QUINTANA GARCIA FERNANDO,,3001006075,VERACRUZ DE IGNACIO DE LA LLAVE,ALVARADO,ALVARADO,743468
,2012,RAMAYO SANDY MANUEL DE ATOCHA,,3105003200,YUCATAN,PROGRESO,PROGRESO,6000
,2012,RAMIREZ JUAREZ JUAN JOSE,,2808007518,TAMAULIPAS,TAMPICO,TAMPICO,647980
,2012,RECIO Y FRIAS ESTHER GLADYS,,3105006823,YUCATAN,PROGRESO,PROGRESO,72000
,2012,"RECOLECCION DE FRUTOS DEL MAR, S.A. DE C.V.",RFM070426H24,2508011802,SINALOA,MAZATLAN,MAZATLAN,246980
,2012,REYES DELGADO CARLOS DAVID,,2701002756,TABASCO,CENTLA,FRONTERA,427572
,2012,REYES GARCIA EDGAR ESTUARDO,,2808007708,TAMAULIPAS,TAMPICO,TAMPICO,226520
,2012,REYNAGA MARTINEZ BASILIO,,2808002543,TAMAULIPAS,TAMPICO,TAMPICO,2589994
,2012,REYNAGA PEÑA BASILIO,,2808006650,TAMAULIPAS,TAMPICO,TAMPICO,207480
,2012,REYNAGA PEÑA MARTIN GUADALUPE,,2808003475,TAMAULIPAS,TAMPICO,TAMPICO,502520
,2012,REYNAGA PEÑA MONICA ALICIA,,2808006452,TAMAULIPAS,TAMPICO,TAMPICO,240000
,2012,REYNAGA PEÑA NARDA ROSA CECILIA,,2808006668,TAMAULIPAS,TAMPICO,TAMPICO,259980
,2012,"RIO TIGRE ACUACULTORES, S.A. DE C.V.",RTA020221GK9,2801001104,TAMAULIPAS,ALDAMA,ALDAMA,76300
,2012,RIVERA RIVERA PEDRO DE JESUS,,2509002271,SINALOA,CULIACAN,NINGUNO,158000
,2012,"ROBALO IX, S.A. DE C.V.",RIX960430AX7,3010002768,VERACRUZ DE IGNACIO DE LA LLAVE,TUXPAN,TUXPAM DE RODRIGUEZ CANO,215194
,2012,ROBINSON BOURS CASTELO JOSE RODRIGO,,2602007169,SONORA,CAJEME,CIUDAD OBREGON,219200
,2012,ROBLES ALVAREZ FRANCISCO JAVIER,,2808007260,TAMAULIPAS,TAMPICO,TAMPICO,456120
,2012,ROCHIN HERNANDEZ GABRIEL FERNANDO,,2501004739,SINALOA,CULIACAN,CULIACAN ROSALES,178000
,2012,RODRIGUEZ DIAZ MARIA ISABEL,,2604009023,SONORA,GUAYMAS,HEROICA GUAYMAS,142974
,2012,RODRIGUEZ ENCINAS MARIA DE LOURDES,,2604008231,SONORA,GUAYMAS,NINGUNO,218400
,2012,RODRIGUEZ ENCINAS MIGUEL FRANCISCO,,2604006599,SONORA,GUAYMAS,HEROICA GUAYMAS,226520
,2012,RODRIGUEZ MURILLO ANDRES,,2501003160,SINALOA,CULIACAN,CULIACAN ROSALES,176000
,2012,RODRIGUEZ VILLALEJOS MARIO ALBERTO,,2604008637,SONORA,GUAYMAS,SAN JOSE DE GUAYMAS,137900
,2012,ROMELLON HERRERA FRANCISCO ELIAS,,401002860,CAMPECHE,CARMEN,NINGUNO,1202880
,2012,ROSADO PAT SERGIO CANDELARIO,,2306001401,QUINTANA ROO,BENITO JUAREZ,CANCUN,200000
,2012,ROSAS CASTRO ISABEL,,305004749,BAJA CALIFORNIA SUR,LA PAZ,LA PAZ,56000
,2012,ROSES Y AZCORRA RICARDO,,3105000891,YUCATAN,PROGRESO,PROGRESO,60000
,2012,RUIZ GARCIA ADOLFO,,3001009889,VERACRUZ DE IGNACIO DE LA LLAVE,ALVARADO,ALVARADO,540500
,2012,RUIZ MENDOZA MANUEL JESUS,,401002928,CAMPECHE,CAMPECHE,NINGUNO,540000
,2012,RUIZ MORENO JAIME AUGUSTO,,401002902,CAMPECHE,CAMPECHE,SAN FRANCISCO DE CAMPECHE,599960
,2012,RUIZ VILLEGAS MARCELA,,2808004622,TAMAULIPAS,TAMPICO,TAMPICO,1419580
,2012,RUIZ VILLEGAS RAUL,,2808004879,TAMAULIPAS,TAMPICO,TAMPICO,3256320
,2012,"S.C. ACUICOLA AGUILASOCHO, S DE R.L. DE C.V.",AAG981211GS5,2505002465,SINALOA,GUASAVE,GUASAVE,180000
,2012,"S.C. CHELELO, S.C. L",CEL900719IL5,2511001345,SINALOA,AHOME,LOS MOCHIS,992406
,2012,"S.C. DON CHANCHOMON, S.C. DE R.L. DE C.V.",DCA0612109Q1,2701005130,TABASCO,CENTLA,FRONTERA,63840
,2012,"S.C.P. ACUICOLA EL CORAL, S.C. DE R.L.",PAC010408MH1,2504001443,SINALOA,ESCUINAPA,ISLA DEL BOSQUE,22000
,2012,"S.C.P. ACUICOLA LA AVIACION, S.C.L.",PAA960207IC4,2501002378,SINALOA,CULIACAN,CULIACAN ROSALES,180000
,2012,"S.C.P. ACUICOLA MAR AZUL, SECC. 4 S DE R.L.",PAM981013KK5,2505002416,SINALOA,GUASAVE,EL TORTUGO,100000
,2012,"S.C.P. DE BIENES Y SERVICIOS GUASAVE CUATROCIENTOS, S.C.L. DE C.V.",PBS950222B33,2505001798,SINALOA,GUASAVE,GUASAVE,1409120
,2012,"S.C.P. LOS CACAXTES, S.C.L.",PCA970919K97,2501002444,SINALOA,CULIACAN,CULIACAN ROSALES,186000
,2012,S.C.P.A  DUNALIELA S.C.L,PAD960116BD9,2501001990,SINALOA,CULIACAN,ELDORADO,184000
,2012,"S.C.P.A. AGUAS Y PESCA LOS GAVILANES, S.C.L.",PAA960519B15,2501002543,SINALOA,CULIACAN,CULIACAN ROSALES,80000
,2012,"S.C.P.A. CAMARONES DE LA PLAYA, S. DE R.L. DE C.V.",PCA9601253SA,2501002550,SINALOA,ANGOSTURA,ANGOSTURA,184000
,2012,"S.C.P.A. CIELO AZUL DEL PACIFICO, S.C. DE R.L.",PAC0505022L6,2509001901,SINALOA,NAVOLATO,NAVOLATO,156000
,2012,"S.C.P.A. CULTIVADORES DEL SUR DE SINALOA, S.C.L.",PAC870817CU1,2504000999,SINALOA,ESCUINAPA,ESCUINAPA DE HIDALGO,40000
,2012,"S.C.P.A. EL BOTETERO, S.C. DE R.L.",PAB000612A40,2506001177,SINALOA,ANGOSTURA,ANGOSTURA,158000
,2012,"S.C.P.A. EL CHERE, S.C.L.",PAC9507097W0,2501002337,SINALOA,CULIACAN,CULIACAN ROSALES,24000
,2012,"S.C.P.A. EL PINTORCITO, S.C.L.",PAP951212BS1,2509002253,SINALOA,NAVOLATO,NAVOLATO,16000
,2012,"S.C.P.A. LA EDUARDA, S.C.L. DE C.V.",PAE961216CS6,2501002352,SINALOA,CULIACAN,CULIACAN ROSALES,150000
,2012,"S.C.P.A. LOS PEREZ DE LA ISLA, S.C DE R.L. DE C.V.",PIS0505266R4,2504001625,SINALOA,ESCUINAPA,ESCUINAPA DE HIDALGO,12000
,2012,"S.C.P.A. PLAYA ESCONDIDA, S.C. DE R.L.",PAP010807RL2,2507003412,SINALOA,AHOME,LOS MOCHIS,72000
,2012,"S.C.P.A. SANTA JULIETA, S.C. DE R.L. DE C.V.",PAS040402LP3,2501003707,SINALOA,CULIACAN,CULIACAN ROSALES,90000
,2012,"S.C.P.A.E. CASA BLANCA LOS ANGELES, S.C.L.",PAE960513DX5,2501002022,SINALOA,CULIACAN,CULIACAN ROSALES,180000
,2012,"S.C.P.A.E. COSTAS DEL MAR DE CORTES, S.C. DE R.L. DE C.V.",PAE990314KN1,2505002507,SINALOA,GUASAVE,GUASAVE,94000
,2012,"S.C.P.A.E. GRANJA EL PINTOR, S.C.L.",PAE960214EY3,2501002261,SINALOA,CULIACAN,CULIACAN ROSALES,72000
,2012,"S.C.P.A.E. LUCENILLA DE PONCE, S.C. DE .RL.",LPO020430A34,2501003434,SINALOA,CULIACAN,CULIACAN ROSALES,139600
,2012,"S.C.P.A.S. ACUACULTIVOS RAMIREZ, S. DE R.L. DE C.V.",PAS950514N23,2509000986,SINALOA,GUASAVE,GUASAVE,188800
,2012,"S.C.P.P. ACUICOLA EJ. ACUACULTORES DEL MAR AZUL, DE R.L. DE C.V.",PPA941014JI6,2505002051,SINALOA,GUASAVE,GUASAVE,112000
,2012,"S.C.P.P. ACUICOLA LA ENSENADA, S.C. DE R.L. DE C.V.",PPA020628380,2506000948,SINALOA,ANGOSTURA,COSTA AZUL,92000
,2012,"S.C.P.P. ACUICOLA VALDEZ, S.R.L. DE C.V.",PPA950510P49,2507001333,SINALOA,GUASAVE,TIERRA Y LIBERTAD,264000
,2012,"S.C.P.P. ALACRAN REEF, S.C. DE R.L.",PPA9502128S1,3105004802,YUCATAN,PROGRESO,PROGRESO,86800
,2012,"S.C.P.P. ALT.E. 12 DE DICIEMBRE, S.C.L.",SCP771111NU3,2511000065,SINALOA,AHOME,TOPOLOBAMPO,911960
,2012,"S.C.P.P. ARTÍCULO 27 CONSTITUCIONAL, S.C.L.",PPA611106AW1,2508000789,SINALOA,MAZATLAN,MAZATLAN,891096
,2012,"S.C.P.P. AUTENTICOS PREGRESEÑOS, S.C. DE R.L.",PAP910415QH3,3105003622,YUCATAN,PROGRESO,PROGRESO,4000
,2012,"S.C.P.P. CAMPOS ACUICOLA, S.C. DE R.L.",PPC9808026U5,2507002117,SINALOA,AHOME,LOS MOCHIS,180000
,2012,"S.C.P.P. CHUY ELIZONDO, S.C. DE R.L.",PPC980620CM4,2511002020,SINALOA,AHOME,LOS MOCHIS,142974
,2012,"S.C.P.P. DE ACUICOLA Y RIBERA DE ALTA MAR PESQ. MAR DEL PACIFICO, S.C.L.",PPA970730IJ9,2607003676,SONORA,PUERTO PEÑASCO,PUERTO PEÑASCO,226520
,2012,"S.C.P.P. DE ALT. ISLA DE PAJAROS DE GUAYMAS, S.C.L.",SCP750720CR6,2604000923,SONORA,GUAYMAS,SONORA,246980
,2012,"S.C.P.P. DE ALTAMAR DE LAS 200 MILLAS DE MAR PATRIMONIAL, S.C. DE R.L.",SCP760914PF3,305000242,BAJA CALIFORNIA SUR,LA PAZ,LA PAZ,316540
,2012,"S.C.P.P. DE ALTURA RAMON ARMENTA MONTOYA, S.C.L.",PPA970130HF1,2511001972,SINALOA,AHOME,LOS MOCHIS,288000
,2012,"S.C.P.P. DE BIENES Y SERV. PUNTA DE PERIHUETE, S. DE R.L. DE C.V.",PBS950717KW3,2508014632,SINALOA,GUASAVE,GUASAVE,650500
,2012,S.C.P.P. DE INT. OFICIAL Y PART. EST. DE PROF. Y ALUM.,SCP7509191Y4,1802000206,NAYARIT,SAN BLAS,BAHIA DE MATANCHEN,160000
,2012,"S.C.P.P. EJIDAL FRANCISCO LEY IBARRA, S.C.L.",PPE9512122G9,2509001000,SINALOA,NAVOLATO,EL MOLINO (EL MOLINO DE SATAYA),243200
,2012,"S.C.P.P. EL MOLINO DE SATAYA, S.C.L.",MSS950627C26,2509001034,SINALOA,CULIACAN,CULIACAN ROSALES,169600
,2012,S.C.P.P. ENSENADA DE CELESTUN,PPE810201PW4,3101000366,YUCATAN,CELESTUN,CELESTUN,57000
,2012,"S.C.P.P. EQUIPOS MARINOS DE FRONTERA, S.C. DE R.L. DE C.V.",EMF030415QJA,2701004570,TABASCO,CENTLA,FRONTERA,448824
,2012,"S.C.P.P. ESCAMEROS Y CAMARONEROS DE PEÑASCO, S.C.L.",SCP870914NG4,2607002082,SONORA,PUERTO PEÑASCO,PUERTO PEÑASCO,950690
,2012,"S.C.P.P. GRAL ALBERTO OVIEDO MOTA, S.C.L.",PPG650120IQ6,207001926,BAJA CALIFORNIA,MEXICALI,MEXICALI,362000
,2012,"S.C.P.P. LANGOSTEROS DE PROGRESO, S.C. DE R.L.",LPC9703129G9,3105004364,YUCATAN,PROGRESO,PROGRESO,405648
,2012,"S.C.P.P. MARIO MORENO, S.C.L.",SCP730613E21,2508001050,SINALOA,MAZATLAN,MAZATLAN,645582
,2012,"S.C.P.P. NICOLAS BRAVO, S.C. DE R.L. DE C.V.",PPN611106BT6,2508000797,SINALOA,MAZATLAN,MAZATLAN,2118302
,2012,"S.C.P.P. OCEAN PARADISE ACUACULTORES, S.C. DE R.L DE C.V.",PPO050201NL0,2506001243,SINALOA,ANGOSTURA,ANGOSTURA,144000
,2012,"S.C.P.P. PESCADORES DE SISAL, S.C. DE R.L.",PPP680718VB7,3108000096,YUCATAN,PROGRESO,PROGRESO,343836
,2012,"S.C.P.P. PESCADORES DEL GOLFO DE MEXICO, S.C. DE R.L.",CPP5801149X6,3105000610,YUCATAN,PROGRESO,PROGRESO,96000
,2012,"S.C.P.P. PRODUCTORES Y PROCESADORES DE MARISCOS, S.A. DE R.L. DE C.V.",SCP110406JL1,2005004789,OAXACA,SALINA CRUZ,SALINA CRUZ,259980
,2012,"S.C.P.P. REAL CELESTUN, S.C.L.",PPR950518JM2,3101000713,YUCATAN,PROGRESO,PROGRESO,76000
,2012,"S.C.P.P. SIXTO OSUNA, S.C.L.",SCP700501G5A,2508001126,SINALOA,MAZATLAN,MAZATLAN,30000
,2012,"S.C.P.P. SUCETT, S.R.L. DE C.V.",SSU960716NA2,2511001790,SINALOA,AHOME,LOS MOCHIS,1324400
,2012,"S.C.P.P. TRES HERMANOS, DE MAZATLAN, S.C. DE R.L. DE C.V.",PPT980513AJ0,2508010127,SINALOA,MAZATLAN,MAZATLAN,78400
,2012,"S.C.P.P. Y B Y S RAMON CONTRERAS, S.R.L.",SPB960615128,2507001549,SINALOA,SALVADOR ALVARADO,GUAMUCHIL,176000
,2012,"S.C.P.P. Y DE SERVICIOS DEL PACIFICO, S.C. DE R.L.",PPS980708BX5,2507002703,SINALOA,AHOME,TOPOLOBAMPO,486500
,2012,S.C.P.P.A LOS SANCHEZ COTA S.C DE R.L,PPS941115LJ7,2507001879,SINALOA,AHOME,LOS MOCHIS,160000
,2012,S.P.R. ACUICOLA COPLAMAR DE R.I.,ACO990806P95,2604011284,SONORA,GUAYMAS,HEROICA GUAYMAS,110000
,2012,S.P.R. ACUICOLA LA PIEDREÑA DE R.I.,API9907252Z5,2604011219,SONORA,GUAYMAS,HEROICA GUAYMAS,104000
,2012,S.P.R. DE R.I. ESTERO LOS MELAGOS,PRR9410098M1,2602002012,SONORA,CAJEME,CIUDAD OBREGON,160000
,2012,S.P.R. DE R.I. LA LOMA DE FELIX,PRR940824AF0,2602005478,SONORA,CAJEME,CIUDAD OBREGON,259200
,2012,S.P.R. DE R.I. LA LOMA DE LALLO,PRR940808MMA,2602002087,SONORA,CAJEME,CIUDAD OBREGON,176000
,2012,"S.P.R. NUEVA JERUSALEM, DE R.I.",NJS961017RD5,2501002501,SINALOA,CULIACAN,SAN RAFAEL,70000
,2012,"S.P.R.A. CASA BLANCA, R.I.",PRA970605T36,2501002428,SINALOA,CULIACAN,CULIACAN ROSALES,160000
,2012,S.S.S. ISLA PAJAROS DE R.L.,IPS921217IL0,3102000613,YUCATAN,DZILAM DE BRAVO,DZILAM DE BRAVO,43200
,2012,SALAS FERRER JUAN MANUEL,,3010002651,VERACRUZ DE IGNACIO DE LA LLAVE,TUXPAN,TUXPAM DE RODRIGUEZ CANO,72000
,2012,SALAS GALAVIZ MARIA DEL ROSARIO,,2604001400,SONORA,GUAYMAS,HEROICA GUAYMAS,292600
,2012,SALAZAR BARRERA ARTURO DE JESUS,,3105003291,YUCATAN,PROGRESO,PROGRESO,33792
,2012,SANCHEZ GONZALEZ JOSE MANUEL,,3105000404,YUCATAN,PROGRESO,PROGRESO,503094
,2012,SANCHEZ PLAZA ROBERTO,,2508015118,SINALOA,MAZATLAN,MAZATLAN,320000
,2012,SANCHEZ REBOLLEDO BENJAMIN,,401002373,CAMPECHE,CARMEN,LA CONCORDIA,95094
,2012,SANCHEZ ROSADO LUIS ALBERTO,,2005003815,OAXACA,SALINA CRUZ,SALINA CRUZ,146520
,2012,SANLUCAS GURIGUTIA MARIA ONELIA DEL CARMEN,,2701004877,TABASCO,CENTLA,FRONTERA,144000
,2012,SANTA MARIA MS SC DE RL DE CV,SMM061128,2509002032,SINALOA,CULIACAN,CULIACAN ROSALES,303800
,2012,SANTIAGO ROJAS JAIME,,3001009723,VERACRUZ DE IGNACIO DE LA LLAVE,ALVARADO,ALVARADO,226520
,2012,SCPA ACUICOLA EL BOTETERO SC DE RL,PAA980317CVA,2506000922,SINALOA,CULIACAN,CULIACAN ROSALES,160000
,2012,"SCPA Y DE SER. EL INTERMITENTE, S.C.L.",PAS950317EM1,2505002002,SINALOA,GUASAVE,GUASAVE,80000
,2012,"SCPAE ACUACULTURA MATACAHUI,SCL",SCA901001IP6,2507000459,SINALOA,AHOME,HIGUERA DE ZARAGOZA,120000
,2012,SCPAE PLAYA NEGRA SCL ,PAE861210FI8,2507000608,SINALOA,AHOME,LAS GRULLAS MARGEN IZQUIERDA,204800
,2012,"SCPP ACUICOLA CAMARON NORTE, S.C.L.",PPA9603126Y3,2507001655,SINALOA,AHOME,LOS MOCHIS,160000
,2012,SCPP BEATRIZ AURELIA SC DE RL DE CV,PPB110326,2507005581,SINALOA,AHOME,LOS MOCHIS,259980
,2012,"SCPP DE FARALLON, S.C.L.",SCP740219MP9,2511000099,SINALOA,AHOME,TOPOLOBAMPO,440020
,2012,SCPP EGRESADOS DEL CECYTEM DE LA CRUZ DE HUANACAXTLE SC DE RL DE CV,PPA790611K51,1802000420,NAYARIT,SAN BLAS,SAN BLAS,648508
,2012,"SCPP GOLFO DE TEHUANTEPEC, S, C. DE R.L.",SCP7403251K1,2005000282,OAXACA,SALINA CRUZ,SALINA CRUZ,656754
,2012,"SCPP PESCADORES DE YUCALPETEN, S.C. DE R.L.",PPP9902155Y3,3105005049,YUCATAN,PROGRESO,PROGRESO,210000
,2012,"SCPP SANTA CRUZ, S.C. DE R.L.",PPS6102045P3,2005000068,OAXACA,SALINA CRUZ,SALINA CRUZ,215194
,2012,SCPP. VETS DE LA REV MEX SC DE RL DE CV,PPV650714F72,2508001159,SINALOA,MAZATLAN,MAZATLAN,280000
,2012,SCPPE Y BS ACUICOLA CAMARONERA STYL S DE RL DE CV,PPE960305RWA,2505002135,SINALOA,GUASAVE,TIERRA Y LIBERTAD,174400
,2012,"SELECTA DE GUAYMAS, S.A. DE C.V.",SGU871021QD2,2604007704,SONORA,GUAYMAS,HEROICA GUAYMAS,1029000
,2012,SELEM BERRON JUAN,,2306000494,YUCATAN,PROGRESO,PROGRESO,1084004
,2012,SILLAS RAMIREZ JUANA,,2607002595,SONORA,PUERTO PEÑASCO,PUERTO PEÑASCO,226520
,2012,SOBERANES CASTRO MAXIMINO,,2511001436,SINALOA,GUASAVE,GUASAVE,519960
,2012,SOBERANES LERIGETH PEDRO FRANCISCO,,2604006318,SONORA,GUAYMAS,SAN JOSE DE GUAYMAS,553000
,2012,SOTELO RUIZ GILBERTO IGNACIO,,2607003452,SONORA,PUERTO PEÑASCO,PUERTO PEÑASCO,292600
,2012,SOTO GONZALEZ CATARINO,,2508005853,SINALOA,MAZATLAN,MAZATLAN,235194
,2012,SOTO GONZALEZ FRANCISCO JAIME,,2607002660,SONORA,PUERTO PEÑASCO,PUERTO PEÑASCO,292600
,2012,SOTO MENDIVIL IGNACIO,,2607004351,SONORA,PUERTO PEÑASCO,PUERTO PEÑASCO,292600
,2012,SOTO MENDIVIL MABY CORIN,,2607002678,SONORA,PUERTO PEÑASCO,PUERTO PEÑASCO,140000
,2012,SOTO NAVARRO MANUEL DE JESUS,,2609003534,SONORA,CAJEME,CIUDAD OBREGON,372400
,2012,SOTO TAPIZ JESUS SALVADOR,,2604011359,SONORA,GUAYMAS,SAN JOSE DE GUAYMAS,226520
,2012,"SRY PROMOTORA ACUICOLA, S.A. DE C.V.",SPA091230E79,2602401073,SONORA,CAJEME,CIUDAD OBREGON,723000
,2012,"TECNO MAR GRANJA, S.P.R. DE R.L. DE C.V.",TMG041030133,2602006930,SONORA,SAN IGNACIO RIO MUERTO,BAHIA DE LOBOS,66000
,2012,TERAN MARTINEZ LILIA,,2808005454,TAMAULIPAS,TAMPICO,TAMPICO,427980
,2012,"TOPOLOBAMPO 2004, S.C. DE R.L. DE C.V.",TDM040524FK9,2511002111,SINALOA,AHOME,LOS MOCHIS,213500
,2012,TORRI GALINDO MARIA DEL PILAR ANGELES,,3010002586,VERACRUZ DE IGNACIO DE LA LLAVE,TUXPAN,SANTIAGO DE LA PEÑA,90000
,2012,TORRUCO GRANIEL LORENTE,,2701005395,TABASCO,CENTLA,FRONTERA,96000
,2012,"TRES SOCIOS SONORENSES IMPULSORA ACUICOLA, S.A. DE C.V.",TSS060608RE5,2602006948,SONORA,CAJEME,CIUDAD OBREGON,336000
,2012,UC CUEVAS MARIO,,3105000438,YUCATAN,PROGRESO,PROGRESO,191840
,2012,"ULTRAMARINOS BALAM, S.A. DE C.V.",UBA910520BU0,2604010062,SONORA,GUAYMAS,HEROICA GUAYMAS,320780
,2012,URBINA DEL ANGEL CYNTHIA PATRICIA,,2808006692,TAMAULIPAS,TAMPICO,TAMPICO,180000
,2012,VAL MALDONADO MARIO,,2501002865,SINALOA,CULIACAN,CULIACAN ROSALES,92000
