main_ID,Ano,Beneficiario,RFC,RNPA,Estado,Municipio,Localidad,Monto
,2014,IGNACIO SOTO MENDIVIL,,2607004351,SONORA,PUERTO PEÑASCO,PUERTO PEÑASCO,0
,2014,MABY CORIN SOTO MENDIVIL,,2607002678,SONORA,PUERTO PEÑASCO,PUERTO PEÑASCO,0
,2014,MANUEL DE JESUS SOTO NAVARRO,,2609003534,SONORA,CAJEME,CIUDAD OBREGON,1200
,2014,GILBERTO IGNACIO SOTELO RUIZ,,2607003452,SONORA,PUERTO PEÑASCO,PUERTO PEÑASCO,2750
,2014,JESUS SALVADOR SOTO TAPIZ,,2604011359,SONORA,GUAYMAS,HEROICA GUAYMAS,0
,2014,LILIA TERAN MARTINEZ,,2808005454,TAMAULIPAS,TAMPICO,TAMPICO,67279.2
,2014,LORENTE TORRUCO GRANIEL,,2701005395,TABASCO,CENTLA,FRONTERA,840
,2014,MARIA DEL PILAR ANGELES TORRI GALINDO,,3010002586,VERACRUZ DE IGNACIO DE LA LLAVE,TUXPAN,SANTIAGO DE LA PEÑA,6165
,2014,MARIANO TORRES HERRERA,,3001007958,VERACRUZ DE IGNACIO DE LA LLAVE,ALVARADO,ALVARADO,0
,2014,CYNTHIA PATRICIA URBINA DEL ANGEL,,2808006692,TAMAULIPAS,TAMPICO,TAMPICO,0
,2014,MARCO ANTONIO URIAS ESPINOZA,,2609001975,SONORA,PUERTO PEÑASCO,PUERTO PEÑASCO,0
,2014,JAVIER VAZQUEZ GUTIERREZ,,2701005171,TABASCO,CENTRO,VILLAHERMOSA,5300
,2014,MARIO VAL MALDONADO,,2501002865,SINALOA,CULIACAN,ELDORADO,3700
,2014,CARLOS VAZQUEZ OROZCO,,2808007013,TAMAULIPAS,TAMPICO,TAMPICO,60800
,2014,ESTANISLAO VARGAS PERALES,,3010002552,VERACRUZ DE IGNACIO DE LA LLAVE,TUXPAN,TUXPAM DE RODRIGUEZ CANO,9450
,2014,WENCESLAO VALDEZ SOSA,,2509002263,SINALOA,NAVOLATO,EL MOLINO (EL MOLINO DE SATAYA),11660
,2014,JAVIER MARTIN VELASQUEZ BLEE,,3105005460,YUCATAN,PROGRESO,PROGRESO,175
,2014,MARTIN VELAZQUEZ CUEVAS,,3105002863,YUCATAN,PROGRESO,PROGRESO,0
,2014,OMAR IVAN VELAZQUEZ ENCISO,,2701004778,TABASCO,CENTLA,FRONTERA,9840
,2014,FELICIANO VERGARA JIMENEZ,,2501003665,SINALOA,CULIACAN,CULIACAN ROSALES,1850
,2014,JAIME OTHON VENTURA MICHEL,,2604001848,SONORA,GUAYMAS,HEROICA GUAYMAS,0
,2014,ANTONIO VERASTEGUI OROZCO,,2808005785,TAMAULIPAS,TAMPICO,TAMPICO,62650
,2014,OSCAR VELAZQUEZ VAZQUEZ,,2701005403,TABASCO,CENTLA,FRONTERA,8610
,2014,DIEGO ARISTIDES VERDUGO ZAZUETA,,2501004325,SINALOA,CULIACAN,ELDORADO,500
,2014,ARTURO ZARAGOZA CATALAN,,2604006268,SONORA,GUAYMAS,HEROICA GUAYMAS,3750
,2014,CARLOS MANUEL ZACARIAS DIB,,3105002921,YUCATAN,PROGRESO,PROGRESO,3000
,2014,FELIPE DE JESUS ZACARIAS DIB,,3105003085,YUCATAN,PROGRESO,PROGRESO,13280
,2014,VICTOR ZACARIAS Y DIB,,3105003267,YUCATAN,PROGRESO,PROGRESO,0
,2014,EDITH ZAVALA VAZQUEZ,,401004973,CAMPECHE,CAMPECHE,SAN FRANCISCO DE CAMPECHE,0
,2014,AMANECER ACUICOLA SA DE CV,,2506000971,SINALOA,ANGOSTURA,PLAYA COLORADA,5400
,2014,AVANCE ACUICOLA SA DE CV,,2505003323,SINALOA,ANGOSTURA,ANGOSTURA,15000
,2014,ACCION ACUACULTURA SA DE CV,,2609003641,SONORA,HUATABAMPO,JUPARE,0
,2014,ASP ACUACULTORES S.A. DE C.V.,,2505004917,SINALOA,AHOME,LOS MOCHIS,0
,2014,SOCIEDAD COOPERATIVA ACUICOLA AGUILASOCHO S DE RL DE CV,,2505002465,SINALOA,GUASAVE,CASA BLANCA,13800
,2014,ACUICOLA ALCATRAZ SA DE CV,,2611001120,SONORA,HERMOSILLO,HERMOSILLO,0
,2014,AVANCE ANGOSTURA SA DE CV,,2505000634,SINALOA,ANGOSTURA,ANGOSTURA,15000
,2014,ACUICOLA LOS ANGELES SA DE CV,,2501003079,SINALOA,CULIACAN,CULIACAN ROSALES,12600
,2014,ACUICOLA LOS AHUMADA SSS,,2507001341,SINALOA,GUASAVE,CASA BLANCA,19200
,2014,"AGRICOLA Y ACUILA EL SAUZ, S.A. DE C.V.",,2501002998,SINALOA,CULIACAN,CULIACAN ROSALES,500
,2014,ACUICOLA AURELIA SA DE CV,,2509002172,SINALOA,CULIACAN,CULIACAN ROSALES,18200
,2014,"ACUACULTURA DE BAJA CALIFORNIA, S.A. DE C.V.",,203012521,BAJA CALIFORNIA,ENSENADA,EL SAUZAL DE RODRIGUEZ,15000
,2014,ACUICOLA BAJA MAR SA DE CV,,2507002075,SINALOA,AHOME,LOS MOCHIS,7400
,2014,"ACUICOLA COCA, SA DE CV",,2602002350,SONORA,CAJEME,CIUDAD OBREGON,0
,2014,ACUICOLA BLUE SHRIMP SPR DE RL,,2507004683,SINALOA,AHOME,LOS MOCHIS,2250
,2014,ACUICOLA BLANQUITA,,2501002329,SINALOA,CULIACAN,NICOLAS BRAVO,0
,2014,ACUACULTURA BIOTECNOLOGICA SA DE CV,,2602002301,SONORA,CAJEME,CIUDAD OBREGON,0
,2014,ACUICOLA BUENA VISTA SA DE CV,,2505003026,SINALOA,GUASAVE,CASA BLANCA,19200
,2014,ACUICOLA CAMARGO SA DE CV,,2507004675,SINALOA,AHOME,LOS MOCHIS,0
,2014,ACUICOLA CAÑAVERAL SC DE RL DE CV,,2506001607,SINALOA,ANGOSTURA,LA REFORMA,22200
,2014,ACUICOLA CAMARONES DE LA BANDERA SC DE RL DE CV,,2507005961,SINALOA,AHOME,LOS MOCHIS,0
,2014,"ACUICOLA CUATE MACHADO, SA DE CV",,2505003570,SINALOA,SALVADOR ALVARADO,BENITO JUAREZ,1000
,2014,ACUICOLA CAMARONES ORGANICOS SC DE RL DE CV,,2507005532,SINALOA,AHOME,LOS MOCHIS,0
,2014,ACUICOLA EL COCODRILO SC DE RL DE CV,,2507005979,SINALOA,AHOME,LOS MOCHIS,0
,2014,ALMACENES CONGELADOS S.A. DE C.V.,,2508005069,SINALOA,MAZATLAN,MAZATLAN,0
,2014,"ACUICOLA CAMACOA, SPR DE RI",,2507001606,SINALOA,AHOME,LOS MOCHIS,0
,2014,ACUICOLA DE COSTA RICA SA DE CV,,2602003069,SONORA,CAJEME,CAJEME PRODUCTOS PECUARIOS,0
,2014,ACUICOLA EL CRUSTACEO SA DE CV,,2509001448,SINALOA,NAVOLATO,LA BANDERA,770
,2014,"ACUACOM, SC DE RL DE CV",,2509002057,SINALOA,CULIACAN,CULIACAN ROSALES,3780
,2014,ACUAVERSI SC DE RL DE CV,,2508015944,SINALOA,MAZATLAN,MAZATLAN,3200
,2014,ACUACAM SA DE CV,,2801000692,TAMAULIPAS,TAMPICO,TAMPICO,4200
,2014,AGROPRODUCTORA DARCAR SPR DE RL,,2602004562,SONORA,CAJEME,CIUDAD OBREGON,0
,2014,ACUICOLA DON CHICO S.P.R. DE R.I.,,2505004263,SINALOA,GUASAVE,GUASAVE,0
,2014,ACUICOLA DON EMILIO SC DE RL DE CV,,2509002461,SINALOA,CULIACAN,CULIACAN ROSALES,0
,2014,"ACUICOLA DON JORGE, SA CV",,2508009491,SINALOA,MAZATLAN,MAZATLAN,54600
,2014,ACUICOLA DOÑA KIKA SPR DE RL DE CV,,2602007078,SONORA,CAJEME,CIUDAD OBREGON,0
,2014,"ACUACULTURA EL DORADO, S.A. DE C.V.",,2501003046,SINALOA,CULIACAN,ELDORADO,1000
,2014,"ACUICOLA EJIDAL KAMMAROS, S DE RL DE CV",,2501002923,SINALOA,CULIACAN,ELDORADO,600
,2014,ACUICOLA ELAIME SPR DE RI,,2505003752,SINALOA,GUASAVE,GUASAVE,0
,2014,ACUACULTORES DEL EVORA SC DE RL DE CV,,2505003042,SINALOA,SALVADOR ALVARADO,GUAMUCHIL,25400
,2014,ACUICOLA LAS FLORES SPR DE RI,,2505002354,SINALOA,GUASAVE,GUASAVE,1000
,2014,ACUICOLA LOS GONZALEZ SA DE CV,,2505002564,SINALOA,GUASAVE,TAMAZULA,14800
,2014,AQUA INDUSTRIAS SA DE CV,,2501003301,SINALOA,CULIACAN,CULIACAN ROSALES,0
,2014,"ARMADORES INTERNACIONALES, S.A. DE C.V.",,401002910,CAMPECHE,CAMPECHE,LERMA,56840
,2014,AQUACULTIVOS DE KINO SA DE CV,,2611001112,SONORA,HERMOSILLO,HERMOSILLO,0
,2014,ACUICOLA LAGO SA DE CV,,2509001380,SINALOA,NAVOLATO,EL LIMONCITO,1692
,2014,ACUICOLA LA LOMA SA DE CV,,2507004410,SINALOA,GUASAVE,GUASAVE,16796
,2014,PESQUERA ALMARABEL SA DE CV,,2508009822,SINALOA,MAZATLAN,MAZATLAN,62040
,2014,ACUICOLA MARION SA DE CV,,2509001869,SINALOA,CULIACAN,CULIACAN ROSALES,0
,2014,"ARMADORES MARION, S.A DE C.V",,2808006130,TAMAULIPAS,TAMPICO,TAMPICO,22400
,2014,ACUICOLA EL MANGLE,,2507001671,SINALOA,SALVADOR ALVARADO,GUAMUCHIL,0
,2014,"ACUICOLA MAYO,S.P.R. DE R.I.",,2505002697,SINALOA,GUASAVE,LA BRECHA,1000
,2014,ACUICOLA MAR DE CORTEZ SA DE CV,,2506000757,SINALOA,SALVADOR ALVARADO,GUAMUCHIL,14800
,2014,ACUICOLA MELANIE SA DE CV,,2509002180,SINALOA,CULIACAN,CULIACAN ROSALES,1000
,2014,"ACUICOLA MARISMAS DEL GOLFO, SC DE RL. DE C.V",,2505004297,SINALOA,ANGOSTURA,ANGOSTURA,0
,2014,ACUICOLA MV SA DE CV,,2506001136,SINALOA,ANGOSTURA,LA REFORMA,4200
,2014,"ASTUR NAVIERA, S.A DE C.V",,2808002758,TAMAULIPAS,TAMPICO,TAMPICO,164960
,2014,ACUICOLA NORE  SPR DE RL,,2602401214,SONORA,CAJEME,CIUDAD OBREGON,0
,2014,"ACUAGRICOLA DEL NOROESTE, S.A. DE C.V.",,2501002964,SINALOA,CULIACAN,CULIACAN ROSALES,4300
,2014,"ACUICOLA 11 DE DICIEMBRE, SA DE CV",,2602001899,SONORA,CAJEME,CIUDAD OBREGON,0
,2014,ACUICOLA OPEN SEA SA DE CV,,2507003727,SINALOA,AHOME,HIGUERA DE ZARAGOZA,3540
,2014,ACUICOLA EL PARAJE SA DE CV,,2506000930,SINALOA,ANGOSTURA,ALHUEY,500
,2014,"ATUNERA PENINSULAR, S.A. DE C.V.",,203004783,SINALOA,MAZATLAN,MAZATLAN,318000
,2014,ACUICOLA PLEAMAR SA DE CV,,2507002323,SINALOA,AHOME,LOS MOCHIS,0
,2014,ACUICOLA PERLA MARINA S.A DE C.V.,,2506000823,SINALOA,CULIACAN,CULIACAN ROSALES,500
,2014,ACUICOLA PRISAMAR,,2505002648,SINALOA,GUASAVE,GUASAVE,22842
,2014,ACUACULTORES DEL QUINTO DIA SPR DE RL (GRANJA CHICURA),,2507003115,SINALOA,AHOME,LOS MOCHIS,2250
,2014,AQUACTIVA SA DE CV,,2611000932,SONORA,HERMOSILLO,HERMOSILLO,0
,2014,AQUATOP SPR DE RL,,2602006690,SONORA,CAJEME,CIUDAD OBREGON,0
,2014,"AQUASOLES, SA DE CV",,2602005486,SONORA,CAJEME,CIUDAD OBREGON,0
,2014,ACUICOLA EL RAULIO SC DE RL DE CV,,2506002027,SINALOA,ANGOSTURA,LA REFORMA,0
,2014,ACUACULTORES DE LA REFORMA S.A. DE C.V,,2505003398,SINALOA,ANGOSTURA,LA REFORMA,600
,2014,ACUICOLA RIVERA MONTOYA,,2505003158,SINALOA,ANGOSTURA,LA ILAMA,4050
,2014,ACUICOLA ROCHTER SA DE CV,,2507002364,SINALOA,AHOME,LOS MOCHIS,0
,2014,ACUICOLA ROJA SPR DE RI,,2507002596,SINALOA,AHOME,LOS MOCHIS,1280
,2014,"ARMADORA RODRIGUEZ, S.A DE C.V",,2808007492,TAMAULIPAS,TAMPICO,TAMPICO,71680
,2014,ACUICOLA ROMA S.P.R. DE R.L. DE C.V.,,2509002149,SINALOA,CULIACAN,CULIACAN ROSALES,250
,2014,ACUICOLA ROSCO SC DE RL DE CV,,2506001870,SINALOA,CULIACAN,CULIACAN ROSALES,0
,2014,ACUICOLA ROSARITO SA DE CV,,2506002126,SINALOA,CULIACAN,CULIACAN ROSALES,0
,2014,"ACUICOLA RINCON DEL TIGRE, SC DE RL DE CV",,2505002580,SINALOA,GUASAVE,LA BRECHA,600
,2014,ACUICOLA SELECTA SA DE CV,,2605001110,SONORA,HERMOSILLO,HERMOSILLO,339125.23
,2014,ACUICOLA SAN FERNANDO SA DE CV,,2605001102,SONORA,HERMOSILLO,HERMOSILLO,0
,2014,"AQUACULTURA SANTA FE, S.A. DE C.V.",,2605001276,SONORA,HERMOSILLO,HERMOSILLO,0
,2014,AZTECA SHRIMP SA DE CV,,2507002589,SINALOA,AHOME,LOS MOCHIS,0
,2014,ACUICOLA SINAMEX SC RL DE CV,,2505003281,SINALOA,SALVADOR ALVARADO,GUAMUCHIL,13970
,2014,ACUICOLA SANTA MAGDA SA DE CV,,2602007151,SONORA,CAJEME,CIUDAD OBREGON,1000
,2014,ACUICOLA SANTA RITA S.A DE C.V.,,2507001705,SINALOA,AHOME,LOS MOCHIS,1000
,2014,"ACUASHRIMP, SPR DE RI",,2507002109,SINALOA,AHOME,SAN LORENZO VIEJO,11800
,2014,ACUACULTORES SIGLO VEINTIUNO SC DE RL DE CV,,2505004529,SINALOA,GUASAVE,EL HUITUSI,13800
,2014,ACUICOLA LOS TRES COMPADRES SA DE CV,,2505002978,SINALOA,SALVADOR ALVARADO,GUAMUCHIL,0
,2014,"ACUICOLA TIERRA DE CANAAN, S.A. DE C.V.",,2507004485,SINALOA,AHOME,AHOME,0
,2014,"ACUICOLA TARAHUMARA DURAN,SC DE RL DE CV",,2501002907,SINALOA,CULIACAN,CULIACAN ROSALES,250
,2014,ACUICOLA TOPOLOBAMPO S.A. DE C.V,,2507002448,SINALOA,AHOME,MOCHIS (EJIDO MOCHIS),0
,2014,ACUACULTIVO EL TORAL SA DE CV,,2801000882,TAMAULIPAS,TAMPICO,TAMPICO,0
,2014,"ACUACULTURA TECNIFICADA DE TAMAULIPAS, S.A DE C.V",,2808005124,TAMAULIPAS,TAMPICO,TAMPICO,4200
,2014,ATUNEROS UNIDOS DE CALIFORNIA SA DE CV,,203012471,SINALOA,MAZATLAN,MAZATLAN,1614433.6
,2014,ACUICULTORES UNIDOS SAN MARTIN SA DE CV,,2507004998,SINALOA,AHOME,LOS MOCHIS,4000
,2014,ACUICOLA LAS VIBORAS SC DE RL DE CV,,2507005953,SINALOA,AHOME,LOS MOCHIS,0
,2014,ACUICOLA VILLA OCEANICA SA DE CV,,2507004972,SINALOA,AHOME,AHOME,0
,2014,BEAN AB SC DE RL DE CV,,2607603012,SONORA,PUERTO PEÑASCO,PUERTO PEÑASCO,0
,2014,BATURY,,2506000831,SINALOA,ANGOSTURA,BATURY,3000
,2014,"BAJA AQUA FARMS, S.A. DE C.V.",,208001321,BAJA CALIFORNIA,ENSENADA,EL SAUZAL DE RODRIGUEZ,0
,2014,BAJOS DE AJORO SC DE RL DE CV,,2507003503,SINALOA,AHOME,LOS MOCHIS,0
,2014,BM BARCOS CAMARONEROS SA DE CV,,2607603707,SONORA,CABORCA,HEROICA CABORCA,92700
,2014,"BIOLOGIA MARINA, S.A. DE C.V.",,2501002535,SINALOA,CULIACAN,PENINSULA DE VILLAMOROS,4200
,2014,"BEIFE, SPR DE RL",,2501002279,SINALOA,CULIACAN,CULIACAN ROSALES,3100
,2014,"BAHIA T, S. DE R.L. DE C.V.",,2505002689,SINALOA,AHOME,TOPOLOBAMPO,25400
,2014,CORPORATIVO ATUNERO SCORPIO S.A. DE C.V.,,3010002917,VERACRUZ DE IGNACIO DE LA LLAVE,TUXPAN,TUXPAM DE RODRIGUEZ CANO,23980
,2014,"C.T.S. BAIT CO, S.A. DE C.V.",,302001235,BAJA CALIFORNIA SUR,LOS CABOS,CABO SAN LUCAS,28800
,2014,CONGELADOS CAIRO SA DE CV,,2609014259,SINALOA,SALVADOR ALVARADO,GUAMUCHIL,0
,2014,"CRUSTACEOS DE EL CASTILLO, SA DE CV",,2508010176,SINALOA,MAZATLAN,MAZATLAN,4300
,2014,EL CAMARON DORADO SA DE CV,,2609001033,SONORA,CAJEME,CIUDAD OBREGON,0
,2014,CAMARONERA EBENEZER S.A. DE C.V.,,2602004752,SONORA,CAJEME,CIUDAD OBREGON,0
,2014,SOCIEDAD COOPERATIVA CHELELO SCL,,2511001345,SINALOA,AHOME,TOPOLOBAMPO,16540
,2014,"CAMARONES DEL HUITUSSI, S.C. DE R.L. DE C.V.",,2505003364,SINALOA,GUASAVE,EJIDO CALLEJON DE TAMAZULA,0
,2014,"CRUSTACEOS Y MARISCOS DEL GOLFO DE TEHUANTEPEC, S.A. DE C.V.",,2005004359,OAXACA,SALINA CRUZ,SALINA CRUZ,0
,2014,COMERCIALIZADORA DE MARISCOS MAZTAM S.A. C.V.,,2508011810,SINALOA,MAZATLAN,MAZATLAN,36300
,2014,COMERCIALIZADORA DE MARISCOS MARIA ELISA S.A. DE C.V.,,2508016017,SINALOA,MAZATLAN,MAZATLAN,0
,2014,COMEXTUN SA DE CV,,203111746,SINALOA,MAZATLAN,MAZATLAN,499500
,2014,"LA COPA DE ORO, S.P.R. DE R.I",,2501002386,SINALOA,CULIACAN,ELDORADO,0
,2014,"CAMARONERA PALMASOLA, S.A DE C.V",,2808005082,TAMAULIPAS,TAMPICO,TAMPICO,93600
,2014,CORPORACION PESQUERA CAMPECHANA SA DE CV,,401002944,CAMPECHE,CAMPECHE,LERMA,66120
,2014,CONSORCIO PESQUERO DEL GOLFO SA DE CV,,3003005919,VERACRUZ DE IGNACIO DE LA LLAVE,COATZACOALCOS,COATZACOALCOS,0
,2014,SCPP PESCADORES DEL GOLFO DE MEXICO SC DE RL,,3105000610,YUCATAN,PROGRESO,PROGRESO,0
,2014,CAMPECHE PRODUCE SA DE CV,,404001802,CAMPECHE,CHAMPOTON,VILLAMAR,0
,2014,"CONGELADORA REY MAR DE TAMPICO, S.A. DE C.V.",,2808005959,TAMAULIPAS,TAMPICO,TAMPICO,0
,2014,CAMARONERA SAABRA SA DE CV,,401002423,CAMPECHE,CAMPECHE,LERMA,0
,2014,CAMARONERA SAN JUAN S.A. DE C.V.,,2505004305,SINALOA,GUASAVE,CASA BLANCA,19200
,2014,"EL CAMARON SUREÑO,. S. DE P.R. DE R.L.",,305006363,BAJA CALIFORNIA SUR,LA PAZ,LA PAZ,1200
,2014,"COMO VA LA PESCA, S.A DE C.V",,2508008733,SINALOA,MAZATLAN,MAZATLAN,34030
,2014,DESARROLLO ACUICOLA ALTAMURA SC DE RL DE CV,,2509002099,SINALOA,CULIACAN,CULIACAN ROSALES,32320
,2014,DESARROLLO ACUICOLA ASTORGA SA DE CV,,2509001232,SINALOA,CULIACAN,CULIACAN ROSALES,9300
,2014,DESARROLLO ACUICOLA BOJORQUEZ SA DE CV,,2506000864,SINALOA,ANGOSTURA,BATURY,0
,2014,DC ACUICOLA SA DE CV,,2602007268,SONORA,CAJEME,CIUDAD OBREGON,0
,2014,S.C. DON CHANCHOMON S.C. DE R.L. DE C.V.,,2701005130,TABASCO,CENTLA,FRONTERA,2730
,2014,DOS CORONAS Y CUATRO BANDERAS SA DE CV,,2508009210,SINALOA,MAZATLAN,MAZATLAN,49440
,2014,DENEBOLA SA DE CV,,203014741,BAJA CALIFORNIA,ENSENADA,ENSENADA,36735.04
,2014,DORADO DEL GOLFO S.A. DE C.V.,,3010002800,VERACRUZ DE IGNACIO DE LA LLAVE,TUXPAN,TUXPAM DE RODRIGUEZ CANO,36048
,2014,DIOS Y HOMBRE SA DE CV,,2508009202,SINALOA,MAZATLAN,MAZATLAN,0
,2014,DISTRIBUIDORA DE MARISCOS DEL SUR S.A. DE C.V.,,705002988,CHIAPAS,TAPACHULA,PUERTO MADERO (SAN BENITO),0
,2014,DIATOMEA NEGRA SPR DE RL,,1803001070,NAYARIT,ACAPONETA,VALLE DE LA URRACA (EL CABILDO),12700
,2014,DESARROLLO 20 DE OCTUBRE SA DE CV,,2501003525,SINALOA,CULIACAN,CULIACAN ROSALES,0
,2014,"EXPLOTACION ACUICOLA BANAMEI,S DE S.S.",,2506000674,SINALOA,ANGOSTURA,COSTA AZUL,5400
,2014,ECOCAMPOS ACUICOLAS S.C. DE R.L. DE C.V.,,2507003966,SINALOA,AHOME,LOS MOCHIS,2700
,2014,EXPLOTACION ACUICOLA DEL PACIFICO SSS,,2507001226,SINALOA,GUASAVE,MAXIMILIANO R. LOPEZ (EL POCHOTE),0
,2014,"EMBARCACIONES GOLFO DE CALIFORNIA, S.A DE C.V",,2604008165,SONORA,GUAYMAS,HEROICA GUAYMAS,0
,2014,EJIDO GRAL. IGNACIO F. PESQUEIRA SPR DE RI,,2602002277,SONORA,CAJEME,CIUDAD OBREGON,0
,2014,"EXPORTACION MARINA, S.A. DE C.V.",,2508003593,SINALOA,MAZATLAN,MAZATLAN,0
,2014,S.C.P.P. EQUIPOS MARINOS DE FRONTERA S.C. R.L. DE C.V.,,2701004570,TABASCO,CENTLA,FRONTERA,40885
,2014,EJIDO REMANENETES DA SAN IGNACIO RIO MUERTO,,2602001972,SONORA,CAJEME,CIUDAD OBREGON,0
,2014,ENSENADA DE SANTA MARIA SC DE RL DE CV,,2511002145,SINALOA,AHOME,TOPOLOBAMPO,1850
,2014,ECOSHRIMP SUPPLY SA DE CV,,2507004766,SINALOA,AHOME,AHOME,0
,2014,EUROPESCA SA DE CV,,2508011240,SINALOA,MAZATLAN,MAZATLAN,39720
,2014,FREDDIE AVILA S.A. DE C.V.,,2508007073,SINALOA,MAZATLAN,MAZATLAN,5500
,2014,FINCA DOÑA LUISA S DE RL DE CV,,2507002838,SINALOA,GUASAVE,GUASAVE,24400
,2014,FINCACUA SA DE CV,,2801001369,TAMAULIPAS,TAMPICO,TAMPICO,2000
,2014,"FAUNA MARINA CAPTURA Y COMERCIALIZACION DE MARISCOS, S.A. DE C.V.",,2005003260,OAXACA,SALINA CRUZ,SALINA CRUZ,0
,2014,FRECARCON SC DE RL DE CV,,2505004412,SINALOA,GUASAVE,GUASAVE,0
,2014,"FRANCISCO VARGAS SANCHEZ, S.P.R. DE R.I",,2505002655,SINALOA,GUASAVE,GUASAVE,1920
,2014,GRUPO ACUICOLA ANGULO S.P.R. DE R.L.,,2507004519,SINALOA,GUASAVE,EL SACRIFICIO,11800
,2014,GRUPO ACUACULTORES ANGULO SA DE CV,,2505004230,SINALOA,GUASAVE,GUASAVE,0
,2014,"GRUPO ACUICOLA BRUMAR, S DE RL DE CV",,2501005926,SINALOA,CULIACAN,CULIACAN ROSALES,750
,2014,"GEZ ACUICOLA, SPR DE RL",,2609002148,SONORA,CAJEME,PROVIDENCIA,2400
,2014,GRUPO ACUICOLA CDM S DE PR DE RL,,2501006544,SINALOA,CULIACAN,CULIACAN ROSALES,0
,2014,GRANJA ACUICOLA LOS DOS AMIGOSSPR DE RL,,1803001047,NAYARIT,HUAJICORI,HUAJICORI,1280
,2014,"GRANJA ACUICOLA FINISTERRE, S.A. DE C.V.",,2505002671,SINALOA,SALVADOR ALVARADO,GUAMUCHIL,35000
,2014,"GRANJA ACUICOLA KARLA GABRIELA, S.A. DE C.V",,2501006601,SINALOA,CULIACAN,CULIACAN ROSALES,8400
,2014,GRANJA ACUICOLA MARIA ESPERANZA SPR DE RL,,2501003822,SINALOA,CULIACAN,ELDORADO,0
,2014,GRANJAS ACUICOLAS EL PATAGON SA DE CV,,2509000937,SINALOA,CULIACAN,CULIACAN ROSALES,3200
,2014,"GRUPO ACUICOLA SANTAFE, SA DE CV",,2507002455,SINALOA,AHOME,LOS MOCHIS,0
,2014,"GRUPO BANAMEI, S.A. DE C.V.",,2501003483,SINALOA,NAVOLATO,EL PINTOR,1600
,2014,"GRANJA CAMARONERA SAN ESTEBAN, S.A. DE C.V.",,2507004253,SINALOA,GUASAVE,CASA BLANCA,11520
,2014,GRANJA CAMARONERA SAN ISIDRO SPR DE RL DE CV,,2507005797,SINALOA,AHOME,AHOME,0
,2014,"GRANJA CAMARONERA EL TIRADERO, S.P.R DE R.L.",,1803001005,NAYARIT,ACAPONETA,ACAPONETA,0
,2014,"GENITECH, S.A. DE C.V.",,2605001094,SONORA,CAJEME,CIUDAD OBREGON,0
,2014,GRUPO INDUSTRIAL ASOCIADO SA DE CV,,2808006866,TAMAULIPAS,TAMPICO,TAMPICO,610346.8
,2014,GRUPO INVERSIONISTA DEL SURESTE SA DE CV,,401005012,CAMPECHE,CAMPECHE,LERMA,278500
,2014,"GRUPO MAXIMAR, S.A. DE C.V.",,2808007658,TAMAULIPAS,TAMPICO,TAMPICO,41420.8
,2014,GRANJAS MARINAS DE SINALOA SA DE CV,,305006439,BAJA CALIFORNIA SUR,LA PAZ,LA PAZ,360
,2014,"GEOMAR PESQUERA, S.A. DE C.V.",,2604011409,SONORA,GUAYMAS,HEROICA GUAYMAS,5815
,2014,"GENERAL DE PESCA, S.A. DE C.V.",,2508006208,SINALOA,MAZATLAN,MAZATLAN,79200
,2014,"GRUPO PESQUERO OLIMPUS, SA DE CV",,402006571,CAMPECHE,CARMEN,CIUDAD DEL CARMEN,19100
,2014,"GRUPO PESQUERO R&A,  SA DE CV",,2808006858,TAMAULIPAS,CIUDAD MADERO,CIUDAD MADERO,405900
,2014,GRANJAS RIO AZUL SA DE CV,,2609002460,SONORA,CAJEME,CIUDAD OBREGON,1000
,2014,GRANJAS SANTA MARGARITA SA DE CV,,2602002210,SONORA,CAJEME,CIUDAD OBREGON,0
,2014,GRANJA LOS TRES BOTONCAUER SPR DE RL,,1805001375,NAYARIT,ROSAMORADA,PIMIENTILLO,0
,2014,HERSEA SA DE CV,,203011994,DISTRITO FEDERAL,MIGUEL HIDALGO,MIGUEL HIDALGO,0
,2014,HERNANDEZ Y PTANIK SA DE CV,,203126560,SONORA,GUAYMAS,SONORA,600
,2014,INVERSIONES BACOCHIBAMPO SA DE CV,,2604006110,SONORA,GUAYMAS,HEROICA GUAYMAS,78450
,2014,INDA DE LA HACIENDA  SPR. DE RL,,2504001641,SINALOA,ESCUINAPA,ESCUINAPA DE HIDALGO,0
,2014,INDUSTRIAL NAVIERA CMAPECHANA,,401002498,CAMPECHE,CAMPECHE,LERMA,25600
,2014,"INMOVILIARIA OSIBA, SA DE CV",,2508015019,SINALOA,MAZATLAN,MAZATLAN,0
,2014,JM ACUACULTURA SA DE CV,,2507003586,SINALOA,AHOME,LOS MOCHIS,3800
,2014,JORLI SA DE CV,,2508007156,SINALOA,MAZATLAN,MAZATLAN,59400
,2014,"K & B TUNA, S.A. DE C.V.",,3010002669,VERACRUZ DE IGNACIO DE LA LLAVE,TUXPAN,TUXPAM DE RODRIGUEZ CANO,217198.86
,2014,"KIMA CORPORATION, S.A. DE C.V.",,203014204,BAJA CALIFORNIA,ENSENADA,ENSENADA,0
,2014,LLAOS ACUACULTURA,,2602000697,SONORA,CAJEME,CIUDAD OBREGON,0
,2014,"LAMARCA, S.P.R. DE R.L. DE C.V.",,3108000666,YUCATAN,MERIDA,MERIDA,0
,2014,LARVAS GENESIS SA DE CV,,2602005692,SONORA,CAJEME,CIUDAD OBREGON,0
,2014,"LARVAS GRAN MAR, S.A. DE C.V.",,305006942,BAJA CALIFORNIA SUR,LA PAZ,LA PAZ,1200
,2014,"LINAMAR, S.A DE C.V",,2508007958,BAJA CALIFORNIA,ENSENADA,ENSENADA,0
,2014,LA LOMA DE LALLO SPR DE RI,,2602002087,SONORA,CAJEME,CIUDAD OBREGON,0
,2014,"LARV MAR, S.A. DE C.V.",,2507002372,SINALOA,AHOME,LOS MOCHIS,14500
,2014,"SOCIEDAD COOPERATIVA DE PRODUCCION PESQUERA ""LANGOSTEROS DE PROGRESO"" S.C DE R.L",,3105004364,YUCATAN,PROGRESO,PROGRESO,0
,2014,SC LUCENILLA DE PONCE SC DE RL,,2501003434,SINALOA,CULIACAN,ELDORADO,3996
,2014,LOMA DE LAS PITAYAS SOCIEDAD DE SOLIDARIDAD SOCIAL,,2505002440,SINALOA,GUASAVE,GUASAVE,7590
,2014,"LAURAS SHRIMP, S.A. DE C.V.",,2507003958,SINALOA,AHOME,AHOME,357596.4
,2014,MAREA ACUICOLA S DE RL DE CV,,2507004808,SINALOA,AHOME,LA FLORIDA VIEJA,2172
,2014,"MARICULTURA, S.A. DE C.V.",,2506000872,SINALOA,SALVADOR ALVARADO,GUAMUCHIL,4200
,2014,"MARATUN, S.A. DE C.V.",,601002124,COLIMA,MANZANILLO,MANZANILLO,866859.27
,2014,"MARTUNA, S.A. DE C.V.",,601002116,COLIMA,MANZANILLO,MANZANILLO,337523.34
,2014,MASPESCA SA DE CV,,3105005791,YUCATAN,PROGRESO,PROGRESO,0
,2014,"MAZPESCA, SA DE CV",,2508010150,SINALOA,MAZATLAN,MAZATLAN,329437.98
,2014,MARNAR DE CAMPECHE SA DE CV,,401002662,CAMPECHE,CAMPECHE,SAN FRANCISCO DE CAMPECHE,14000
,2014,MARLIN DEL CARIBE S.A DE C.V.,,3105003051,YUCATAN,PROGRESO,PROGRESO,0
,2014,MAR DE LA CORINA SA DE CV,,203005814,BAJA CALIFORNIA,ENSENADA,ENSENADA,407.65
,2014,MARITIMA INTERCONTINENTAL SA DE CV,,203011630,BAJA CALIFORNIA,ENSENADA,ENSENADA,26675
,2014,MARINOS DEL LITORAL SA DE CV,,401002613,CAMPECHE,CAMPECHE,LERMA,10000
,2014,"MUY MEXICANOS, S.A DE C.V",,2508008741,SINALOA,MAZATLAN,MAZATLAN,23100
,2014,MARISCOS DEL PACIFICO SUR SA DE CV,,2005000399,OAXACA,SALINA CRUZ,SALINA CRUZ,0
,2014,MAZ SARDINA SA DE CV,,2508009525,SINALOA,MAZATLAN,MAZATLAN,1395892.6
,2014,"MARISCOS SRA. CAROLINA, S.A. DE C.V.",,2510001544,SINALOA,MAZATLAN,LOS ARRAYANES (EL SAUCITO),0
,2014,EL MOLINO DE SATAYA S.S.S. SOCIEDAD DE SOLIDARIDAD SOCIAL,,2509001034,SINALOA,CULIACAN,CULIACAN ROSALES,8850
,2014,"MORALES TAMEZ, S.A DE C.V",,2808007252,TAMAULIPAS,TAMPICO,TAMPICO,44480
,2014,"MARBELLO DE TAMPICO, S.A DE C.V",,2808004226,TAMAULIPAS,TAMPICO,TAMPICO,99640
,2014,"MALTA TEXO DE MEXICO, S.A DE C.V.",,2507004725,SINALOA,AHOME,EL HECHO,250
,2014,NUTRIMENTOS ACUICOLAS AZTECAS SA DE CV,,2501003863,JALISCO,SAN PEDRO TLAQUEPAQUE,TLAQUEPAQUE,1000
,2014,NAVIERA ALEJANDRE SA DE CV,,402005276,CAMPECHE,CAMPECHE,SAN FRANCISCO DE CAMPECHE,89250
,2014,NAVIERA CAJUN DOMINGUEZ  SA DE CV,,401003082,CAMPECHE,CAMPECHE,SAN FRANCISCO DE CAMPECHE,0
,2014,NAVIERA CAMPECHE MARVEL SA DE CV,,401004502,CAMPECHE,CAMPECHE,SAN FRANCISCO DE CAMPECHE,97750
,2014,NEMARZA Y COMPAÑIA SA DE CV,,401002480,CAMPECHE,CAMPECHE,LERMA,14250
,2014,"NUTRIMENTOS DE LA CRUZ, S.A. DE C.V.",,2501007633,SINALOA,ELOTA,LA CRUZ,2100
,2014,NAVIERA DOLCA SA DE CV,,401002654,CAMPECHE,CAMPECHE,SAN FRANCISCO DE CAMPECHE,35150
,2014,NAVIERA FIFER SA DE CV,,401003132,CAMPECHE,CAMPECHE,SAN FRANCISCO DE CAMPECHE,0
,2014,NAVEGANTES DEL GOLFO SA DE CV,,3105006914,YUCATAN,PROGRESO,PROGRESO,3630
,2014,NAVIERA HERNANDEZ ZAPATA SA DE CV,,402006290,CAMPECHE,CARMEN,CIUDAD DEL CARMEN,77600
,2014,"NUEVA JERUSALEM, SRP DE RI",,2501002501,SINALOA,CULIACAN,CULIACAN ROSALES,4460
,2014,NAVIERA MEXICANA SAN BERNARDO SA DE CV,,203004478,BAJA CALIFORNIA,ENSENADA,ENSENADA,27539.84
,2014,NAVIERA NEVAREZ SA DE CV,,2808006023,CAMPECHE,CAMPECHE,SAN FRANCISCO DE CAMPECHE,18500
,2014,NAVIERA DEL PUERTO DE CAMPECHE SA DE CV,,401003447,CAMPECHE,CAMPECHE,LERMA,3000
,2014,NAVIERA Y PESQUERA CONCORDIA SA DE CV,,401004486,CAMPECHE,CAMPECHE,SAN FRANCISCO DE CAMPECHE,93500
,2014,NAVIERA PERCEL SA DE CV,,401003165,CAMPECHE,CAMPECHE,SAN FRANCISCO DE CAMPECHE,46750
,2014,"NAVIERA Y PESQUERA HERNANDEZ, S.A DE C.V",,2808006494,TAMAULIPAS,TAMPICO,TAMPICO,8800
,2014,NAVIERA Y PESQUERA MIROLAMASA DE CV,,401003637,CAMPECHE,CAMPECHE,SAN FRANCISCO DE CAMPECHE,55250
,2014,NAVIERA Y PESQUERA EL MORRO,,2808004739,CAMPECHE,CAMPECHE,SAN FRANCISCO DE CAMPECHE,22200
,2014,"NAVIERA Y PESQUERA DEL PACIFICO, S.A. DE C.V.",,311000293,BAJA CALIFORNIA SUR,COMONDU,PUERTO SAN CARLOS,0
,2014,NAVIERA Y PESQUERA PEREZ Y PEREZ SA DE CV,,401004429,CAMPECHE,CAMPECHE,SAN FRANCISCO DE CAMPECHE,14800
,2014,NAVIERA PUERTO PROGRESO SA DE CV,,2604010336,SINALOA,MAZATLAN,MAZATLAN,0
,2014,NAVIERA RAMIREZ SA DE CV,,401003512,CAMPECHE,CAMPECHE,SAN FRANCISCO DE CAMPECHE,2500
,2014,NAVIERA SAN JORGE SA DE CV,,401004478,CAMPECHE,CAMPECHE,LERMA,14060
,2014,NAVIERA YARELE SA DE CV,,401002894,CAMPECHE,CAMPECHE,SAN FRANCISCO DE CAMPECHE,29500
,2014,OASIS ACUICOLA SA DE CV,,2611000973,SONORA,HERMOSILLO,HERMOSILLO,750
,2014,11 DE DICIEMBRE DE 1996 SPR DE RI,,2602001881,SONORA,CAJEME,CIUDAD OBREGON,1200
,2014,OPERADORA ENSENADA SA DE CV,,203013842,BAJA CALIFORNIA,ENSENADA,EL SAUZAL DE RODRIGUEZ,19950
,2014,"OPERADORA LAURA ANTONIANA, S.A. DE C.V.",,2508011679,SINALOA,MAZATLAN,MAZATLAN,21760
,2014,ORFESA DEL MAR DE CORTEZ SA DE CV,,2607003700,SONORA,PUERTO PEÑASCO,PUERTO PEÑASCO,0
,2014,OPERADORA MARITIMA DEL PACIFICO S.A. DE C.V.,,2508005366,SINALOA,MAZATLAN,MAZATLAN,347370
,2014,OLAS DEL PERIHUETE SA DE CV,,2506001938,SINALOA,ANGOSTURA,ANGOSTURA,0
,2014,"ORGANIC SHRIMP, S.A. DE C.V.",,305006520,BAJA CALIFORNIA SUR,LA PAZ,MELITON ALBAÑEZ DOMINGUEZ,0
,2014,OCEAN SEED SPR DE RI,,2507001564,SINALOA,AHOME,LOS MOCHIS,0
,2014,SOC. COOP. DE PRODUCCION ACUICOLA AVILAS SC DE RL,,2506001409,SINALOA,ANGOSTURA,LA REFORMA,32900
,2014,PESQUERA AGUA AZUL SA DE CV,,2604006433,SONORA,GUAYMAS,HEROICA GUAYMAS,0
,2014,SCPA LA AVIACION SC DE RL DE CV,,2501002378,SINALOA,NAVOLATO,NAVOLATO,1000
,2014,"S.C.P.A. AGUAS Y PESCA LOS GAVILANES, S.C.L.",,2501002543,SINALOA,CULIACAN,EL MELON,550
,2014,SC DE PROD ACUICOLA ACUACULTORES DE MONTELARGO SCL,,2501001974,SINALOA,NAVOLATO,MONTELARGO,0
,2014,SOCIEDAD COOPERATIVA DE PRODUCCION ACUICOLA EL BOTETERO SC. DE RL.,,2506000922,SINALOA,CULIACAN,CULIACAN ROSALES,0
,2014,"S.C.P.A. EL BOTETERO, S.C. DE R.L.",,2506001177,SINALOA,ANGOSTURA,LA REFORMA,0
,2014,SOC. COOP. DE PRODUCCION ACUICOLA EL CORAL. S.C. DE R.L.,,2504001443,SINALOA,ESCUINAPA,ISLA DEL BOSQUE,0
,2014,"SOCIEDAD COOPERATIVA DE PRODUCCION ACUICOLA ""CIELO AZUL DEL PACIFICO"" SC DE RL",,2509001901,SINALOA,CULIACAN,CULIACAN ROSALES,1500
,2014,"POTENCIAL ACUICOLA, SA DE CV",,2505004420,SINALOA,GUASAVE,ALAMITO CAIMANERO,5400
,2014,S.C.P.A. CULTIVADORES DEL SUR DE SINALOA SCL,,2504000999,SINALOA,ESCUINAPA,ESCUINAPA DE HIDALGO,0
,2014,"SOCIEDAD COOPERATIVA DE PRODUCCION ACUICOLA EL CHERE, S.C.L.",,2501002337,SINALOA,CULIACAN,CULIACAN ROSALES,420
